{
  "schema_version": "1.0.0",
  "manifest_id": "gis-yfinance-eod-v1",
  "manifest_version": "1.0.0",
  "ticker": "GIS",
  "instrument_identity": {
    "instrument_id": "GIS",
    "instrument_type": "ordinary_share",
    "trading_currency": "USD"
  },
  "source_authority": {
    "authority_class": "secondary_reference",
    "provider_id": "yfinance"
  },
  "dataset_identity": {
    "dataset_id": "gis-yfinance-daily-close",
    "dataset_kind": "price"
  },
  "instrument_mapping": {
    "venue_id": "NYSE"
  },
  "allowed_use": {
    "scope": "internal_valuation",
    "redistribution_allowed": false
  },
  "license_evidence": {
    "evidence_ref": "https://finance.yahoo.com/"
  },
  "retention_policy": {
    "policy_id": "local-research-cache"
  },
  "revision_policy": {
    "policy_id": "source-revisions-preserved"
  },
  "lifecycle_status": "active",
  "effective_from": "2026-01-01"
}
