{
  "schema_version": "1.0.0",
  "manifest_id": "ko-sec-shares-v1",
  "manifest_version": "1.0.0",
  "ticker": "KO",
  "instrument_identity": {
    "instrument_id": "KO",
    "instrument_type": "ordinary_share",
    "trading_currency": "USD"
  },
  "source_authority": {
    "authority_class": "issuer_official",
    "provider_id": "sec-edgar"
  },
  "dataset_identity": {
    "dataset_id": "ko-sec-reported-shares",
    "dataset_kind": "share_count"
  },
  "instrument_mapping": {
    "venue_id": "NYSE"
  },
  "allowed_use": {
    "scope": "internal_valuation",
    "redistribution_allowed": false
  },
  "license_evidence": {
    "evidence_ref": "https://www.sec.gov/edgar/"
  },
  "retention_policy": {
    "policy_id": "local-research-cache"
  },
  "revision_policy": {
    "policy_id": "source-revisions-preserved"
  },
  "lifecycle_status": "active",
  "effective_from": "2026-01-01"
}
